id,board,context,chunk,keyword
126,男女,"就只是個故事而已，以前發過在別的網站，也發來這裡，一個故事。

真心誠意

昨天下午去醫院掛號骨科，醫生問說哪裡不舒服，跟醫生說我運動時腳突然再痛，醫生說
是哪裡在痛，指了位置後，醫生說是阿基里斯腱發炎，很危險，如果不好好休息的話會阿
基里斯腱斷裂，叫我要休息三個禮拜不可以再運動，下個月工作很多，卻受傷了。

今天多了些時間出來，想要把圖書館借的書找時間來看，有多出時間才打了這篇文章。

約十五年前，大概約21歲時候的事情。在學校念書時，半工半讀當學校的工讀生，有位對
我很好的女上司，有天上司電腦前，有個小男生對者電腦裡的韓星裴勇俊桌布照片笑得燦
爛，那時只覺得這個小男生聲音怪怪的，還有笑容很燦爛可愛，只是那時心裡的動了，也
許是心動了，也許是不知如何形容的感覺吧，這個女同事是打扮的男性化

那時如果沒有開口跟她當朋友，也許就不會有後來的那些事情吧？打字的有些累了，腕隧
道症候群加上乾眼症電腦不敢用久，有些事情記的很清楚，儘管已經約十五年了。

以前這些事情，對現在的我而言其實不怎麼重要。
剛剛家人在使用推車搬舊型CRT電視時，推車輾到亂丟的鞋子，電視雜到我家人的腳，勸
她去看醫生她不肯，雖然八點檔很多都要看很久沒啥營養，今年陪我家人看到""一家人
""劇中黃文星得知罹患癌症，想到了他還有爸媽要孝順，還有他愛的人
其實對我而言甚麼重要甚麼不重要，心裡知道

當時會開口跟她當朋友是問我室友，不知道如何當朋友，室友教了我一些方法，當時採用
了其中一個方法，就是請他喝飲料開口當朋友，這方法雖然不高明，但那時也沒想這麼多
，請她喝時，她有問說為何這麼做，我也只是傻傻的跟她說想要當朋友。

那時聽說學生會舉辦的幹部訓練她也要去，我也報名參加這個，不知道要做甚麼的活動，
卻在那時身體不舒服，她有問我怎麼了身體哪裡不舒服，說很關心我，有次那時天氣很熱
時我跟她說好熱，她用手摸了我臉頰，那時感覺得想了很多，僅次於有次身體不舒服去保
健室，工讀生用體溫計後，再用額頭貼我的額頭說沒發燒，儘管他們對我都沒那個意思，
只是我想太多，有位室友知道我喜歡那個女生，曾經說我應該去聽""愛的代價""和張震嶽""
想太多""這兩首歌

對我來說愛情有時候是殘忍的，就像六弄咖啡館中的有些內容，有次從她口中聽到她說很
在乎我，然而我弟的朋友剛好認識她，說是以前讀同間高職很有名的女同性戀，愛打籃球
，是學校的風雲人物之類的

攻略t妹 只是甚麼掰直之類的沒怎麼想過

一個人一輩子只喜歡一個人這不合理，儘管後來認識些異性，大都覺得普普通通

甚麼""一生只愛你一人""我也不太相信

那時喜歡她的時候很認真的控制體重，從可能原本八十幾公斤減到約六十九公斤，身高
172公分體重八十幾，實在不好看，大叔了，體重當年減多少也有點忘了，青春留不住，
記憶也沒那麼好了，很有很多方面都很拼，工作認真之類的，但畢竟只有我單方面的喜歡
，從很多事情都看得出來，沒急踩煞車，是想都沒想過

第一次打電話給她，勸她早點睡對身體比較好，她說＂干我屁事＂打電話給她也常常不接
不回，有次還說你很無聊，現在想一想，是不喜歡男的，還是不喜歡我，也沒那麼重要了
，朋友有人認識她，說她曾說她常常都晚上睡別人家，她爸媽不管的，朋友補上一句覺得
她很隨便和屁股很翹之類的話，第一次和她一起吃飯強迫我和她吃一樣的，同一間的，好
像是說我吃飯都很慢之類的，卻常常和她一起吃飯，是好朋友或著只是同事間吃個飯都沒
那麼重要，那時只確定了我心意是真心誠意的，於是在認識她一年後，跟她說了 一件事

有人曾經問過我，如果可以再見她一面的話，想說甚麼，只想著有些事情我不是故意的，
但為什麼要再見她一面？相見不如懷念。


要出門去剪頭髮了，明天要去參加我姑姑的女兒的婚禮，她女兒都大概三十七歲~三十八
歲了，又逢年底，今天冬至吃湯圓多一歲，也快要到明年囉，女生過三十五歲後是懷孕是
高齡產婦，對產婦和兒子女兒都不好，好像是健康等因素？現在要結婚都要有勇氣，最近
我堂哥的大兒子也將要結婚，娶大陸的女生，是同事，印象中大陸台灣是敵對的，要娶大
陸的女生限制較多

室友一同參加幹部訓練時，室友有跟他朋友吩咐拍個幾張她的照片，而且還放大我有拿去
護貝，照片最後只留了一張，放了十幾年，最後被我哥在前幾年未經過我同意之下丟掉，
跟我哥說不要亂丟掉，我哥說是又長的不漂亮，以前我哥有看過她的照片，有拿給我爸媽
和我祖母和我弟看過，爸是叫我不要追她，祖母說不像女生，幾年前有貼過照片在我臉書
，最主要是想起女上司對我的好和想她對我的好，只是都已不在身旁了，女上司於幾年前
乳癌過世，後來有拿掉照片，覺得未經過別人允許放上去不好

國中同學看到照片後曾問說我是不是同性戀？
只記得最後的最後她說要去考軍校，我不是發自內心的說，考軍校很好阿，她說她周遭很
多人都說不好，最後還是壓抑不住還是跟她說喜歡他，已經喜歡她很久了，然而她沒有答
應，甚至還從我朋友那裏得知，有個很喜歡她的人在追求她，但是個很差勁的人，其實說
出這些無聊的事情，大概還真的是我無聊吧？受傷而不能去運動，必須暫停運動三個禮拜

至於她傳簡訊說我單戀她和騷擾她，我爸媽也知道這件事情，不知為何打給她，年紀大我
兩歲，只是同事間吃個飯，把我當弟弟，謝謝之類的話，爸拿著我的手機說跟她在通一次
電話但就一次就好，以後不要連絡了，我把她的手機號碼刪掉，沒有打給她，我朋友在多
年後，問過我，她朋友中也許還有她的聯絡方法，想幫我問看看，但我依然拒絕，沒有猶
豫太久，不打擾她，就是我的對的選擇，

有沒有考軍校？曾經有約她一起吃飯她說好，但後來沒連絡，就都不重要了，她給我有安
全感和溫暖的感覺，喜歡她陪伴我鼓勵我，曾經說跟我是永遠的好朋友，上次看電影扭轉
時光機，有句台詞是You are my friend, My bestfriend，你是我朋友。我最好的朋友，
有讓我感觸了一下，也許是暫時的感觸吧

剛剪完頭髮，理髮師問我說要剪多短，我說短一點，她問說要比平頭再長些嗎？我也不知
道平頭到底多短，就說好，剪完後看，覺得頭髮太短拉

其實是無聊再提這件事情，有同學看過她照片，曾說是每個人喜好不同，青菜蘿蔔，各有
所好，也有人說啥看起來不錯或是其他的說法

都過去了，沒連絡超過十五年有了吧？上次跟高職同學聚餐，看他侃侃而談，過得不錯，
卻也讓我有了些許感概，自己曾有那麼幾年過的不如意

幾年前說要幫我找她的聯絡方法的朋友，後來去當志願役的樣子，當兵後就沒有連絡了

今年去找同學時，請他幫我補寫個畢業紀念冊時，他上面寫了永遠的好朋友，也讓我感觸
了一下下，當年曾說過無論如何都會和她聚餐的，只是這個約定，早沒有實現的必要拉

收音機傳來音樂 黃小琥 沒那麼簡單

蕭煌奇幫黃小琥作的曲

下真心誠意這個標題，其實有點感覺說的太超過，誇張，畢竟她缺點真的很多我無法接受
，十五年前當工讀生薪水快一萬四千元，她跟別人說賺不夠她花，曾經買了東西說一千元
便宜之類的，貪小便宜，控制慾強，一起吃個飯，強迫我跟她吃同間，說不吃同間就不要
一起吃飯，但這些都跟我沒關係，甚至坦白說就只是個路人，想這些都沒有用

明天要工作，準備早點洗澡刷牙睡覺了，阿基里斯腱昨天又有點不舒服，工作的時候不舒
服了 一陣子，如果過陣子疼痛沒好就必須要再看醫生，又不敢做運動了

時間是不會等人的，與大家分享之

她成績蠻差的有瞄過一眼她的成績單，只有軍訓高分
她離職原因好像是上司逼她做假帳，但她有沒有真的作假帳我也不清楚，其它像是去女廁
所被誤認為男生，考汽車駕照很多次都沒通過

後來是知道被逼做假帳事情被發現一般好像會很大條，很嚴重的後果

都不重要的事情，也沒有我的事情

今天腳又在痛阿。有時候腳痛，心也跟者痛，上次看電視有骨科醫生說他發現退化性關節
炎最早的患者是三十五歲，但我其實在三十二歲就發現左腳膝蓋關節退化，右腳踝關節也
早在二十幾歲就退化，幾年前，大概是一百零一年，就已經退化到最嚴重的狀態，醫生說
不會再退化，儘管如此，還是有工作，但一想到未來就不知道該如何，真的很茫然

相見不如懷念，朋友有人說認識她，也許她的朋友中有人有她的聯絡方法，想試著要她的
聯絡方法，但我問家人和醫生都反對，自己也只想把現在過好，為什麼要繼續保持聯絡，
我是懷疑的，她的照片也沒留下，原本有留一張但我哥未經過我同意把她的照片丟掉，並
且把電腦裡的掃描照片刪掉了

大我至少六歲的女生我也喜歡過，算一算，至少四十三歲了，她早就結婚生小孩了，也不
會再連絡，

表達能力不好，無法表達的很好

要是我聰明的話，就不會這樣曾經落魄潦倒了，我有時會想幸災樂禍乃人之常情，搞不好
他還會幸災樂禍，還好沒在一起。

以前打電話給以前曾經認識的人，她說：謝謝你還記得我，但怎麼看都覺得場面話也說的
太超過了，有點虛偽阿

其實沒甚麼好提的，如果能夠再見她一面的話，想跟她說甚麼？但我覺得過去已經夠痛苦
了，幹嗎還要再見她。

年老色衰 ，自己現在都不敢想她有沒有老了，以前聽她說大我兩歲也就是今年三十九歲
，其實都至少十五年都沒連絡，想這些沒用，跟我年紀差不多的女生，如果懷孕都變成高
齡產婦，過三十五歲就是高齡產婦，人過三十歲後身體就會ˇ走下坡
我媽曾說我被她迷得˙團團轉，但她其實外表不怎樣，感覺就是比內田有紀留短髮的模樣
的劣化很多的劣化版阿

最近刪臉書帳號後，時間多了些出來，認識她還滿像是無效的社交，說沒後悔感覺是騙人
的，這輩子也許最後悔的事情就是認識她拉，例如一起吃飯時，她強迫我要跟她吃同家午
餐，不吃就不要一起吃等，認識她才一年的時間，實在也認識不深，甚至寫email絕交時
，我也跟她說我沒有你這麼不關心我的朋友，當我在看醫生時，她人在哪裡？嘴巴說關心
，就只是講講而已，
__________________

該是運動的時間了，其實睡前兩個小時運動，會影響睡眠，但是今天都還沒運動阿，要做
暖身運動，運動，伸展，當初不知道自己怎麼想的，還天真的認為那年認識她時，是我一
生中最快樂的日子，那天陽光暖暖的灑在她身上，對著電腦桌布相片的裴勇俊照片笑者，
笑的燦爛又可愛，一切是那麼的美好，雖然過了十幾年，但卻讓我印象深刻，那時的心動
，和我後來的落魄潦倒對比之下，真是諷刺，那年我從原本八十幾公斤，瘦到六十幾公斤
，後來才知道瘦太快對身體不好，畢業後少跟人提我哪間學校畢業的，畢竟遇到很多難過
的事情，又是一間在中部沒啥名氣的學校

她最後想考軍校也不知道有沒有去考，不知道有沒有畢業，失去聯絡太久了

還滿好奇你是暈船的感覺嗎？或是其他的感覺？

有人曾跟我說同性戀就是同性戀，不會喜歡異性之類的話阿，有個很喜歡她的人但是個很
差勁的人，輾轉從朋友那得知這消息，其實也是很生氣，但這些跟現在都沒關係了，那些
事情有很重要嗎？重要到現在？

我從圖書館ˋ借了幾本書，有一本是david wang 王再得和其他幾位 說他們如何學習英文
的，書名是我如何學英語 HOW I LEARNED ENGLISH 想抽空來閱讀

早在三十一歲就跟家人說不婚了，說不婚其實是太超過了，畢竟又沒有對象可結婚，感覺
就像是被挑剩下來的，留戀？執著？都沒有意義

落魄潦倒過又家道中落的不知道該怎麼辦，緣起緣滅，不必執著，為了一棵樹放棄整片森
林，有時候其實一切是空，提得起放的下，才是好的，言語無法表達的很清楚，但我希望
她一切都好，如果她希望不再連絡的話，我也不會勉強，所以最後一通電話我也沒打給她
，往事也許是美化了回憶，夕陽無限好只ˋ是近黃昏，想起往事也許是年紀大了，才會有
感觸

爸爸曾經拿了手機給我，說再撥一通電話給她，但就一通就好，以後不要再連絡，但我覺
得人就不要這麼ˊ無聊，自作多情對自己有甚麼幫助，在現實的社會，就該現實一點，沒
有好處的事情有誰會去做

我跟她的緣分早就沒了，也就只是短暫交集，一年過後不會再連絡的那種朋友

另外我不信前世今生，輪迴等

以前聽我朋友說有個很帥很喜歡她的男生，是個很差勁的人，但多年後才想起那個人是我
阿，還跟朋友承認那個人是我，那時體重控制的不錯，但沒有很帥，現在是個中年大叔又
胖

如果真的得到了，對我真的好嗎

其實我是懷疑的

我曾經希望她能夠幸福，後來覺得就算給她幸福的人不是我

其實都無所謂了

睡前看到我以前的這篇留言竟然笑了出來，內田有紀的劣化版阿，那時候我約十五年前，
十六年前不知道到底怎麼想的，甚至有想過帶出去不能夠炫耀，但她傷害我已經很久的事
情了，忘了那位名人說過的，勸女人不要露胸部要露出你的頭腦智慧。

過了十五年了，還記的她胸前掛著一個十字架，有想過不知道是信基督教或是天主教的，
畢竟十字架項鍊感覺就像是有宗教信仰的人在掛的，只是一起吃過飯，曾經的同事，她有
說過她很在乎我很關心我，把我當成她最好的朋友，但這些早就過去，一起吃飯時，有個
她朋友，會把她剩下得飯菜吃光，這點我就做不到了，而且為甚麼要這麼做，無法理解。

光是她說我瘦下來會比較好看，那時候也不知道怎麼想的竟然信了，一起去幹部訓練時，
有個男生說他虎背胸腰，壯得跟頭牛的，我不知道她怎麼想的，只看到她有陣子都不吃飯
，那時候不知怎麼想的，竟然心疼。
今年我爸不知為何跟我媽說

他以前一個喜歡的女生，現在變得很肥，嫁的老公也不好，我爸甚至幸災樂禍起來，說她
現在比我媽還醜，像頭豬

那位女生我以前就聽我爸媽說過幾次，說他以前很漂亮，我爸很喜歡之類的，最後沒結婚

想想我爸會幸災樂禍也是人之常情

只是我有點想不通，當初我找網路諮商時，心理師曾說我要記住我很喜歡的那位，記住喜
歡的感覺之類的，對我來說都過去了，沒聯絡很久，至少有超過十六年了吧？當初她跟我
爸媽說我單戀她和騷擾她，讓我氣炸了，覺得我把我爸媽的臉都丟光了，我喜歡她都是過
去式了，心理師勸我記住喜歡她的感覺，我也沒問，對我來說就是個路人甲乙丙丁。

雖然心理師曾說過就像我想要買雙鞋子，但因為某些理由，沒買到，後來要再買鞋子，發
現沒那麼喜歡其他的鞋子，對我來說有沒有遺憾不重要，甚至我還跟醫生說過，我以前的
朋友說想找他的同學或朋友，去找她的聯絡方法，想一想當初決定不連絡的想法，醫生說
順利的話可能部會怎樣，但不順利的話，怕對我有影響，對我來說根本就不想要和她再聯
絡，當年落魄潦倒，從此有了不同的看法，對我來說就算以後認識的異性都覺得，普通普
通，沒那麼喜歡，但我也不會跟很喜歡的那位聯絡

打了這麼多也沒重要的重點。只是聽我家人討論，一時的不重要的感觸

以前落魄潦倒去讀間根本就不想ˋ讀的學校時，坐火車通勤，遇到清水高中的兩位女生，
對他們比較有好感，但是我沒有勇氣，當初留級時不得已轉成夜校，也很氣，無法再見到
那兩位，但透過臉書，雖然不知道名子，還是找到了那兩位，都結婚了，看著照片也是有
，斷了一些想法的感覺，對我來說早就三十一歲時，就發現能力不夠無法結婚了，過去的
往事拉，看到兩位的照片，也是有感觸，對我來說對方結婚了，搞不好。根本記不得我。

沒有人能夠代替你的笑臉

以前古代有個皇帝很愛的妃子或是皇后，她在死之前，皇帝想再見她一面，她拒絕，理由
是：
以色侍人者，色衰而愛馳。
其中一個網址

她解釋道：「我不過是因為長得美，才得到皇上的寵愛。但我不能想得美，現在我都病成
這樣，樣子肯定很難看，如果讓皇上看到我，肯定會留下不好的印象。不如不見皇上，把
我的美好永遠留在他心中，那樣我死後，他想念我時，必然善待我的家人。」

以前喜歡的人，本來就長的不怎樣，我沒辦法想像她現在四十歲的樣子，以前她說過大我
兩歲

其實不太想提，或是不太想承認，之前看電視節目，SHE說她有一個好消息和一個壞消息
，她吃的龍蝦又大又好吃，但想到以後就吃不到這麼好吃的龍蝦了

我的想法其實是有點這樣類同，但理智告訴我，她實在不適合我，先不論配不配上，個性
和其他的，其實也不適合

一想到已經十六年沒聯絡，突然覺得空虛寂寞冷

至於他有哪裡好的，這麼多年還忘不了，甚至覺得後來認識的異性都普普通通，都是些不
重要的小事

寫到這裡，就已經沒有再繼續打字的念頭，有關她的一切，就只是懷念的過去式而已

Always On My Mind 這首歌 的歌詞有一段 You are always on my mind
你永遠在我內心深處

and i love you so 這首歌 我是如此愛你

我早就看出她沒喜歡過我，一切都只是我單戀而已。

最近剛好在廣播節目中，聽到你是如此難以忘記。這首歌，老實說，雖然對她還有些許感
覺，但現在一切都只是回憶而已，我寧願自己狠心一點，斬斷朋友關係，有些感覺，隨著
時間都變很淡，損失的是誰，我也無所謂，她雖然曾說過還是朋友，但我更相信她說我在
單戀她和騷擾她，是講真的。強摘的果實不甜。

搞不好，別人早就忘了我，其實我很不諒解她的有些行為，

以前想過當作家，但是已經很多年不再提起筆，寫文章了。寫了很多篇文章，才得獎過兩
次很小的獎。

以前高職和二專念機械系，但沒有興趣，二技我去考應用外語英文系，英文大概考了五十
五分左右，那年高標考最高的也才六十幾分，有考上一些學校但是沒有去念，醫生和家人
也勸我不要在念了。

我還記得考夜校，二專時，不知道英文不計分，那時考了六十幾分，但沒算進去分數，一
下子就少了六十幾分，對我來說，真是很誇張犯錯，高職不想念，二專也不想念，其實我
從小到大，都不喜歡念書。

很多人說：得不到的最美。也許吧？只是回憶容易美化，人也不能總是那麼幼稚

最近聽到別人說他的親戚之類的，只有單戀或是特別喜歡一位女生，他就跟他親戚說：又
不是只有一個女人而已，他又不是小兒麻痺，怎麼這麼害怕娶不到老婆？條件又不是太爛
，幹嘛單戀一枝花，委屈自己之類的話。

其實這篇應該是不再回文了，但又有了些感觸，算是補充吧？經過了這麼多年，自己的想
法心態等，都有了些改變，其實她的個性很惹人厭惡，控制慾強，愛穿牛仔褲和NIKE球鞋
，但是台灣潮濕悶熱，有次有聞到她的身體飄出臭味，而且聽到關於她的情報都是不好的
，有同為學生會的人說，一看就不是甚麼正常的女生，有另外的人說她很愛玩，我上司說
同性戀就是同性戀，不會喜歡異性。我朋友說她曾經跟朋友說她常常都外宿別人家，她爸
媽不管的，朋友說她很隨便，愛花錢，貪小便宜等。

過了快十七年有了吧，也許我走不出去，一直看以前，說有多喜歡她也很像不是事實。其
實如果當初有設停損點，早早打退堂鼓，應該就不會有後來的那些經歷

要先學會愛自己，才能愛別人。最近聽到別人在說的那些事情，說小兒麻痺之類的太過超
過，但其他的，也許還有些許道理。

考上那所學校我本來就不想去讀，這麼想的話，就會覺得有些釋懷，從未提起，何來放下
？身似菩提樹，心似明鏡台，時時勤拂拭，莫使惹塵埃。菩提本無樹，明鏡亦非台，本來
無一物，何處惹塵埃。打字到這裡就覺得該停筆了。

gay是男同性戀，t是女同性戀的男的，女同性戀的女的是蕾絲邊

男人婆不一定是t，但t之中有很多男人婆，好像有這個一般的說法

看過網路，t也有分很多種，但我也沒記得很清楚

愛情不是得到就是學到，對我來說有沒有上到不是重點，如果早點放棄，設下停損點，對
我來說會較好。我的成績其實比起同學還來的好，因為當年不知道英文不列入分數，在考
二專時考了六十幾分沒算進去，損失很多，對機械沒興趣，也讀得很爛，對我來說，十幾
年沒聯絡的路人甲乙丙丁，也沒甚麼重提的必要了。

女生沒有人是天生的異性戀，不是同性戀就是雙性戀，新聞有報導過

當初打她電話愛接不接的，也都沒回電話，甚至我看醫生時，她人在哪裡

還有很多我無法接受的缺點等，得到了對我也不一定好

回頭再看這個標題真心誠意，其實有些許諷刺，當初以為那是我一生中最幸福的日子。

不知為何想起有聽過一則故事，有一個人娶了一個外籍新娘，外籍新娘學會了幾個字，分
別是老公，睡覺，吃飯，每天都喊老公吃飯，吃完飯後會喊老公睡覺

說的人還說這樣身體怎麼受的了

人，有些事情適可而止

有時會想到一件事情，海賊王中庸醫西爾爾克，在知道有病患需要醫療，最後知道被騙時
，說：「原來沒有病人啊，真的是太好了。」
我還以為……這個國家發生大事了呢……
　原來……只是我被騙了……」


　你認為人什麼時候才會死……？
　被子彈射穿心臟的時候嗎？不對……
　染上不治之症的時候嗎？不對……
　喝下了……劇毒香菇所熬的湯的時後？都不對……

　是被別人遺忘的時候啊……！

我倒還滿喜歡巴尼說過的一句話，希望你不要怨恨別人也不要責怪自己


朋友說過她胸部很小根本就沒有胸部，另外她唱歌也很難聽，原本的聲音就不到普通水準
，唱歌也是很難聽。有時候重新再看這些，其實也覺得後悔認識她。

--
劍聖席巴：朋友？多麼讓人懷念的字眼阿，已經好久沒有稱得上是朋友的人。

--",二專也不想念,想念
