id,board,context,chunk,keyword
182,男女,"聖誕節跟跨年剛過又是一堆剛在一起的新情侶
本人去年11月到月老廟有拜有保庇，成功年底終結單身
有時候覺得曖昧的過程好有趣，回想起來都覺得好笑

我跟男友是在某T交友APP上認識的
當初只是朋友介紹，抱著姑且一試的的心態下載來玩
而且老實說，現任男友根本就不是我的類型，完全不是！
那時剛認識他時，覺得他人很無聊，就是照三餐打招呼的那種
對比APP上其他很會嘴砲又幽默的人，他真的是讓人毫無記憶點

但身為無聊單身女子的me沒有封鎖他，就有一句沒一句的聊聊而已
即使我回應冷淡或是已讀不回，他也幾乎每天都會跟我問候幾句
還會跟我說他在幹嘛可能會比較晚回，雖然是很老套的打招呼跟閒聊
但某天不知道腦子哪裡的洞突然破了，突然覺得他好像挺可愛的
順勢就答應了他的電影邀約

第一次見面老實說很怕是變態或是約炮的人…
還跟朋友說我要跟網友見面，每一小時打電話給我
不然就到威秀尋人或報警了

沒想到第一次見面就感受到他非常暖啊！
走在路上會默默的把我塞在內側
主動跟我說電影時間多長，提醒我要先上廁所、問我會不會餓
看完電影大概晚上10點多，他人也沒有留戀說要送我回家
我內心還黑人問號，想說不續攤吃個宵夜嗎？

接下來幾乎每天下班他都會來接我一起晚餐、然後去散散步再送我回家
相處下來其實都蠻聊得來的，被同事看到還會被小虧一下

期間歷經聖誕節，一起去了人擠人的新北耶誕城
很意外的是他叫我走在他前面，而不是併行
他說因為併行我會被路人撞到，但前後走
路人會看到他比較大隻顯眼就會閃避了…
當他說出來的瞬間，我的左心室立刻幫他簽了長期租約啊…https://imgur.com/HA71RYy他幫我拍的第一張照片…
不過這位先生的拍照技術還有待加強https://imgur.com/8nSVzrU然後當天氣氛很好我以為他會趁機告白
結果沒有！！！他只有送了我一個禮物～
當下心中只有大哭，我是有這麼沒有魅力嗎QQ
雖然禮物我蠻喜歡的，因為我提過我喜歡貓，就送了可愛的招財貓給我https://imgur.com/cBWhoek他有記得我閒聊隨口說說的話題很令人感動

後來陸陸續續又約出去了幾次，其中一次是一起去陽明山看夜景
那天還蠻冷的我穿錯衣服整個人在發抖
結果他騎車突然停下來，拿了一件外套給我
還叫我在原地等他一下，不知道去哪生了一瓶熱熱的奶茶給我
我愣頭愣腦的還沒反應過來他就摸了一下我的頭
這男的根本高手，默默的在撩妹，突然的貼心我真的很無力抗拒
當下我真的覺得兩頰很熱，瘋狂在腦子裡跑小劇場，一堆OS
他會不會下一秒跟我告白？我要答應嗎？
他會不會直接牽走我的手？我要被牽嗎？
結果一切都是夢，他還是什麼都沒說也沒做

可能他感受到我的失落感，就默默地指了一下我手上的飲料
仔細一看才發現原來包裝上有些字
「如果你渴，我會替妳買喝的
如果你想睡了，我會替你把棉被蓋好……」
看完還沒意會過來他就把我抱在懷裡了，塞得滿滿的
就這樣被get到手了>////////<
他現在還是會虧我當下很囧的表情，說我像貓一樣可愛

到現在都還留著那天的熱奶茶 (洗過了啦XD)https://imgur.com/edJQTRr只是從那天被Get到手後，好像就沒有這種曖昧的感覺了
他反而變得放很開、很會開玩笑說笑話，男生怎麼變得那麼快啊？
不知道大家會不會特別懷念還沒交往前的那段曖昧時光呢？
跟男友也才剛交往，我已經開始懷念了哈哈

--","
不知道大家會不會特別懷念還沒交往前的那段曖昧時光呢",懷念
183,男女,"聖誕節跟跨年剛過又是一堆剛在一起的新情侶
本人去年11月到月老廟有拜有保庇，成功年底終結單身
有時候覺得曖昧的過程好有趣，回想起來都覺得好笑

我跟男友是在某T交友APP上認識的
當初只是朋友介紹，抱著姑且一試的的心態下載來玩
而且老實說，現任男友根本就不是我的類型，完全不是！
那時剛認識他時，覺得他人很無聊，就是照三餐打招呼的那種
對比APP上其他很會嘴砲又幽默的人，他真的是讓人毫無記憶點

但身為無聊單身女子的me沒有封鎖他，就有一句沒一句的聊聊而已
即使我回應冷淡或是已讀不回，他也幾乎每天都會跟我問候幾句
還會跟我說他在幹嘛可能會比較晚回，雖然是很老套的打招呼跟閒聊
但某天不知道腦子哪裡的洞突然破了，突然覺得他好像挺可愛的
順勢就答應了他的電影邀約

第一次見面老實說很怕是變態或是約炮的人…
還跟朋友說我要跟網友見面，每一小時打電話給我
不然就到威秀尋人或報警了

沒想到第一次見面就感受到他非常暖啊！
走在路上會默默的把我塞在內側
主動跟我說電影時間多長，提醒我要先上廁所、問我會不會餓
看完電影大概晚上10點多，他人也沒有留戀說要送我回家
我內心還黑人問號，想說不續攤吃個宵夜嗎？

接下來幾乎每天下班他都會來接我一起晚餐、然後去散散步再送我回家
相處下來其實都蠻聊得來的，被同事看到還會被小虧一下

期間歷經聖誕節，一起去了人擠人的新北耶誕城
很意外的是他叫我走在他前面，而不是併行
他說因為併行我會被路人撞到，但前後走
路人會看到他比較大隻顯眼就會閃避了…
當他說出來的瞬間，我的左心室立刻幫他簽了長期租約啊…https://imgur.com/HA71RYy他幫我拍的第一張照片…
不過這位先生的拍照技術還有待加強https://imgur.com/8nSVzrU然後當天氣氛很好我以為他會趁機告白
結果沒有！！！他只有送了我一個禮物～
當下心中只有大哭，我是有這麼沒有魅力嗎QQ
雖然禮物我蠻喜歡的，因為我提過我喜歡貓，就送了可愛的招財貓給我https://imgur.com/cBWhoek他有記得我閒聊隨口說說的話題很令人感動

後來陸陸續續又約出去了幾次，其中一次是一起去陽明山看夜景
那天還蠻冷的我穿錯衣服整個人在發抖
結果他騎車突然停下來，拿了一件外套給我
還叫我在原地等他一下，不知道去哪生了一瓶熱熱的奶茶給我
我愣頭愣腦的還沒反應過來他就摸了一下我的頭
這男的根本高手，默默的在撩妹，突然的貼心我真的很無力抗拒
當下我真的覺得兩頰很熱，瘋狂在腦子裡跑小劇場，一堆OS
他會不會下一秒跟我告白？我要答應嗎？
他會不會直接牽走我的手？我要被牽嗎？
結果一切都是夢，他還是什麼都沒說也沒做

可能他感受到我的失落感，就默默地指了一下我手上的飲料
仔細一看才發現原來包裝上有些字
「如果你渴，我會替妳買喝的
如果你想睡了，我會替你把棉被蓋好……」
看完還沒意會過來他就把我抱在懷裡了，塞得滿滿的
就這樣被get到手了>////////<
他現在還是會虧我當下很囧的表情，說我像貓一樣可愛

到現在都還留著那天的熱奶茶 (洗過了啦XD)https://imgur.com/edJQTRr只是從那天被Get到手後，好像就沒有這種曖昧的感覺了
他反而變得放很開、很會開玩笑說笑話，男生怎麼變得那麼快啊？
不知道大家會不會特別懷念還沒交往前的那段曖昧時光呢？
跟男友也才剛交往，我已經開始懷念了哈哈

--","我已經開始懷念了哈哈

--",懷念
184,男女,"從高一到現在大二總共四年了
在今年1/1分手 理由是我們不適合
曾經以為我能娶你 現在你就丟一句我們沒關係了...
想念你睡在我身旁安心的睡覺
在機車後座抱我無畏風雨
我努力上班上課準備證照 但你還是覺得不夠
每天載你去上班上課 你卻覺得是應該的
去年12月出車禍雙手雙腳骨折 被公司資遣
無法騎車開車哪都不能去 妳卻被我兄弟載走
雙手打石膏丟了工作 無法考試
你卻說我沒用
我到底怎麼做妳才會滿意...
現在丟了一句四年就當沒發生過
心好痛...

--","從高一到現在大二總共四年了
在今年1/1分手 理由是我們不適合
曾經以為我能娶你 現在你就丟一句我們沒關係了...
想念你睡在我身旁安心的睡覺
在機車後座抱我無畏風雨
我努力上班上課準備證照 但你還是覺得不夠
每天載你去上班上課 你卻覺得是應該的
去年12月出車禍雙手雙腳骨折 被公司資遣
無法騎車開車哪都不能去 妳卻被我兄弟載走
雙手打石膏丟了工作 無法考試
你卻說我沒用
我到底怎麼做妳才會滿意...
現在丟了一句四年就當沒發生過
心好痛...

--",想念
185,男女,"分手四個月了
說好不聯絡也將近一個月

從不想讓任何人知道我們已經分手
到現在可以不會哽咽
大方的跟朋友侃侃而談這件事
雖然難免會有些感傷
但是可以感覺到自己慢慢好起來

這段日子其實過的很快
有關心我的朋友
也會發自內心的微笑
生活中還是有很多值得期待的事物
也有一些讓人煩躁的小事
可以抱怨不愉快
享受小確幸

可是有時候還是會想到他
並不是在想念這個人
但他就是時常冒出來
想到他喜歡吃什麼
他說過什麼話
他做過什麼事
甚至去做沒有一起經歷過的事
卻還是可以想像他如果在旁邊會講什麼

沒事的時候沒事
有時候卻非常痛苦
覺得自己好像就是走不出這個坎...











--","分手四個月了
說好不聯絡也將近一個月

從不想讓任何人知道我們已經分手
到現在可以不會哽咽
大方的跟朋友侃侃而談這件事
雖然難免會有些感傷
但是可以感覺到自己慢慢好起來

這段日子其實過的很快
有關心我的朋友
也會發自內心的微笑
生活中還是有很多值得期待的事物
也有一些讓人煩躁的小事
可以抱怨不愉快
享受小確幸

可是有時候還是會想到他
並不是在想念這個人
但他就是時常冒出來
想到他喜歡吃什麼
他說過什麼話
他做過什麼事
甚至去做沒有一起經歷過的事
卻還是可以想像他如果在旁邊會講什麼

沒事的時候沒事
有時候卻非常痛苦
覺得自己好像就是走不出這個坎...











--",想念
186,男女,"跟前男友分手了ㄧ陣子（大概快五個月），
這陣子自己也有些追求者，但卻沒有ㄧ個看上眼、喜歡的對象，常常會以前任的標準去挑
選這些男生，我這樣的行為是不是很不可取啊？

真的有點害怕自己以後找不到喜歡的人......，
有時候很想跟前男友聊聊心，但聽他說他交了新女友了，我也不好意思這樣煩著他了，唉
......好想念他。

覺得有時候很不公平，為什麼在ㄧ起這麼久，你卻可以很快交下ㄧ任呢？

--","唉
......好想念他",想念
187,男女,"安安 我又來代po了 文長
這次是不同的 很熟的朋友(女)
背景: 朋友和網友都在北美讀書 不同國家

===========
BG板的各位好，最近遇到不知道怎麼辦也不能怎麼辦的事情，所以想上來發文
大概也問不出結果，就當作我抒發一下吧！順便看看各位的意見

四年前玩lol的美服認識了一個台灣人男生，雖然在不同國家，不過因為都是年紀很小的留學生 個性蠻合，加上我那時候沒有什麼朋友，所以那時候感情還不錯，常常一起打LoL聊天。
之間我們當然也有喜歡上對方(那時認識一年)，不過我認為網友就只是網友，不算是真正的認識，可能也不是真正的喜歡。我後來也沒玩這遊戲退坑了。
因為都是相關科系的學生，也認識很久了，偶爾還是有聯絡，像是問課業問題的事情、隨便閒聊一下。就這樣很普通的把他當普通朋友過了兩三年。

昨天半夜突然想玩一下LoL，就line他要不要玩，他剛好喝醉但是還是上線一起玩了。關掉遊戲之後叫我不要掛電話，然後開始說真的喜歡我，一直很想我 他是真心的..... 之類的。一開始覺得是趁醉意胡言亂語，我後來相信了，因為想一想他有時候會問我有沒有交男朋友，什麼時候要交。

我也和他說 抱歉我們已經是幾年前的事情了，我沒有喜歡你，而且你根本不認識我，喜歡上的是想像中的我，清醒一點吧！見面是龍妹的話直接嘔嘔嘔嘔。
他沒有放棄的跡象，說想來我城市找我真正的認識我。我不喜歡他沒關係，只要能跟他聊天把他當朋友就好。
這樣的對話跳針了好多次，我只想要他死心，不要太認真

我自己的想法是真的覺得他很可憐，已經這麼久了怎麼還有這想法…
和網友見面不是什麼大事，我自己也在網路上認識了不少人 也有見面過，男生女生都有。
不過我會下意識的迴避喜歡我的人，尤其是現實中。但是！！又覺得對方很可憐…這是重點
吧…我真的覺得他很可憐，我能說的也只是對不起…能幫他的地方也只是和他說清楚
哈哈，說了這麼多…謝謝有耐心的人看完
如果有的話希望有人可以分享喜歡上女網友然後抽離的過程：）

另外想說一下，因為LoL這遊戲認識了一些網友。但是這遊戲最近這兩季改變得太多，感覺?
ㄓㄛO原來的樣子了，很懷念之前的LoL。
Sent from JPTT on my iPhone

--作者canblow (可吹)標題[問卦] 你室友沒有被___?噓 GGrunrundela: 公三小08/25 00:11→ Skydier: 你有請醫生順便檢查一下腦袋嗎08/25 00:11沒喔 我沒那個東西

--",很懷念之前的lol,懷念
188,男女,"手機發文 無排版請見諒


跟男友在一起一年半了是工作認識的
還在職的時候是住在一起在外租房子
上班地點也一樣所以整天都看到彼此
感情不錯不常吵架 就算吵了也很快合好

但今年年中離職後出國玩了一陣子
回台後也幾乎都住家裡很少見面
最近一兩個月要聊line都不知道要聊什麼
可能我真的在耍廢所以也沒有什麼好說
但主要是覺得兩個人興趣關心的東西差太多
所以沒什麼共同的話題
一直以來我們聊的大部分都是公司的事
（並不是指聊公事 是閒聊遇到什麼客人或同事之間的生活話題 因同公司氣氛很好同事都
是像朋友講幹話 ）
住在一起不過很常各滑各的手機看影片
但我離職後跟前同事也漸漸沒什麼交流了
變得我跟男友不知道要說什麼
頂多早安晚安問候一下
就算彼此分享了什麼東西
但因不了解所以也不知道要回應什麼
很常嗯嗯嘻嘻是喔 這樣子就帶過了
（以前聊line就會有這樣狀況了）
他還是會很常說很想我問我什麼時候要見面
但我沒什麼想跟他約會的想法也不想念他

最近有點想提分手
不過他是我的第一任我不想輕易放棄就說分手
而且他用情很深 真的對我很好
我也知道他被前任傷很深所以不想讓他難過

但我不知道是我已經對他沒感覺了還是純粹只是過渡期

這陣子賴我都是不讀不回已讀不回或是很敷衍
我也知道我這樣很不好
但我就完全沒有想要跟他分享的心情
反而還比較常把生活瑣事跟好姐妹說或是有共同興趣的朋友說

之前也跟他聊過一次這樣的狀況
那時說要努力看看
但最近情況變得更糟了
每天內心都很矛盾
不知道要趕快斷開不要讓彼此卡在現況
還是要繼續撐著靜觀其變


我文字表達能力真的非常很差
無法完全表達出我的想法
希望能理解我想說的QQ



--","手機發文 無排版請見諒


跟男友在一起一年半了是工作認識的
還在職的時候是住在一起在外租房子
上班地點也一樣所以整天都看到彼此
感情不錯不常吵架 就算吵了也很快合好

但今年年中離職後出國玩了一陣子
回台後也幾乎都住家裡很少見面
最近一兩個月要聊line都不知道要聊什麼
可能我真的在耍廢所以也沒有什麼好說
但主要是覺得兩個人興趣關心的東西差太多
所以沒什麼共同的話題
一直以來我們聊的大部分都是公司的事
（並不是指聊公事 是閒聊遇到什麼客人或同事之間的生活話題 因同公司氣氛很好同事都
是像朋友講幹話 ）
住在一起不過很常各滑各的手機看影片
但我離職後跟前同事也漸漸沒什麼交流了
變得我跟男友不知道要說什麼
頂多早安晚安問候一下
就算彼此分享了什麼東西
但因不了解所以也不知道要回應什麼
很常嗯嗯嘻嘻是喔 這樣子就帶過了
（以前聊line就會有這樣狀況了）
他還是會很常說很想我問我什麼時候要見面
但我沒什麼想跟他約會的想法也不想念他

最近有點想提分手
不過他是我的第一任我不想輕易放棄就說分手
而且他用情很深 真的對我很好
我也知道他被前任傷很深所以不想讓他難過

但我不知道是我已經對他沒感覺了還是純粹只是過渡期

這陣子賴我都是不讀不回已讀不回或是很敷衍
我也知道我這樣很不好
但我就完全沒有想要跟他分享的心情
反而還比較常把生活瑣事跟好姐妹說或是有共同興趣的朋友說

之前也跟他聊過一次這樣的狀況
那時說要努力看看
但最近情況變得更糟了
每天內心都很矛盾
不知道要趕快斷開不要讓彼此卡在現況
還是要繼續撐著靜觀其變


我文字表達能力真的非常很差
無法完全表達出我的想法
希望能理解我想說的qq



--",想念
189,男女,"代PO，手機排版，文長請見諒

剛認識男友沒多久的時候，他在社群網站上發了一篇懷念前女友的文章，當時雖然有點在
意，但是想說都是過去的事了，所以並沒有說什麼。
之後我們大概在兩個月後在一起了，有一次他在我旁邊翻手機裡的舊照片，我看到有很多
他跟前女友的舊合照，我心裡有點介意但又想假裝不在意所以開玩笑的說「反正我比較好
看」，沒想到他居然說「有嗎？她也很可愛啊」，那時候我就開始徹底介意了起來，我也
有讓他知道我在意。再過了一個月左右，他有假就要回台北一周（我跟男友人都在外地）
，送他去機場當天，我看到他約前女友回去一起吃個飯，當下有點尷尬，但是他也不知道
要說什麼，然後就回去了，後來我在電話裡問他為什麼要瞞著我約前女友吃飯，他堅持說
只是朋友想關心一下。我就很無法接受這個理由，因為第一，他明明知道我介意，還想要
瞞著我約她出去，第二，因為他前女友工作很忙，當時他們在一起時，她就不怎麼理他（
遠距），分手後更是很少回覆，我不知道他有沒有這麼缺朋友還要主動找她，其實我心裡
上一直覺得要是是前女友主動找他吃飯還不會這麼難過。當時就一直吵架，但他就堅持只
是朋友，他說後來他們也沒見面（但我沒回去，所以不知道他們到底有沒有見面）。而我
心裡還是很在意這件事，而且我也一直覺得事情沒解決，因為我不知道他為什麼要瞞我還
想關心前女友，他也想不出任何辦法減少我的不安全感，所以在他回來後我們又吵了一次
，吵到一個段落時他突然一直盯著我不講話，我問他在看什麼，沒想到他回我「我在看你
跟前女友誰正」，我當時就哭出來，因為我覺得很不被尊重，他就說他只是開玩笑的...
隔
一天因為我送他了一個皮夾，結果從他舊的皮夾裡面翻出兩張他跟他前女友的合照，他說
是忘記拿出來了，但他跟前女友大概一年前就分手了...
後來他說他完全想不出可以讓我有安全感的方法，要我舉幾個給他，所以我就說封鎖前女
友，跟刪掉手機裡的照片，他就在我面前把照片刪了（但他也說照片雲端還有備份），但
就算這樣，其實我心裡還是很介意，是因為我覺得他很沒心，要我說了才想刪除，說實話
，我也不是真的介意他們發生什麼（畢竟前女友很遠很忙），我真正擔心的是他還放不下
前女友...

拜託大家打醒我......
到底是我無理取鬧還是他心裏還有前女友......



--",他在社群網站上發了一篇懷念前女友的文章,懷念
190,男女,"來日本已有些日子了，在這兒，臺灣的消息並不缺乏，她認識了許多留學生，有的想回去
，有的想留下來，各有各的打算。就這樣而已。

她不敢奢求你原諒她對你所做的一切，更不期望你能回信，只是希望你好好工作與生活；
雖然她已經沒有這份要求的權利。

對於這份感情，她沒有絲毫遺憾。她愛得真誠，愛得刻骨銘心，她沒法忘記，也不曾片刻
忘記。儘管它已經過去了，但在她心裡，還是異常珍惜。

真的，一冷她就想起你，想到華岡，想到那些多風多雨、充滿激情的歲月。現在想來，你
們是真正愛過的。你們瘋狂地互相吸引，乃至互相要求對方更多的愛情，以更確立彼此的
地位之外，她想，最後那一年，你們便很少吵架了，她是真心對待你的。

東京的楓葉早已枯萎，現在是滿街黃色的銀杏，很有情調。隨時有人在層層落葉裏尋尋覓
覓。她獨自走在校園裡，踏著厚厚的落葉，總是想起你，似乎一切美好的、抒情的事物，
沒有你就無法感受。她誰都不想，只想你！她總是暗想，銀杏中有她對你的思念，有她所
有的感情，她要將它藏起，不讓別人發覺，只想和你分享。

這兒，冬天的氣氛很濃了，可是才剛要冷，她已不勝寒了。雨天沒有撐傘的你，冷現在已
成為一種沉重的負荷。沒有你，冷不再有情調了。

原以為很多事情都該結束的，可是它們沒有。

如果可能，她願意說：「我想你。」真的。

她深信，你是她唯一愛過的人，再沒有第二個人能在她心中佔有這麼廣大的空間；除了你
，沒有別人。

那華岡的種種，那風、那雨，那山仔后到學校的曲曲折折的小徑，那剛起鍋的油條，那藝
術館的傳奇，那陽明山公園的夜晚，甚至你們激烈爭吵的空教室……，她都不能忘記。這
樣是幸福？抑或不幸？

她老覺得心中有個人，一直佔據不走，抗拒任何外來的感情。自你之後，她沒有愛過任何
一人，機會雖然有，卻不是她所願把握的。

她還活在過去，怎麼辦？好在你們離得遠，否則，只怕她又會連夜趕去看你，然後繾綣終
日了。這相思如何能解？

你在溫暖的臺北，而她在落雪的關東平原，日夜思念早成了她的痼疾。灣就快過農曆年了
，在這兒「年」卻已過去許久，沒有一絲新春的熱鬧氣氛。

東京已入冬，有時會下點雪，她住的這兒是三樓，從窗口望出去，有很美很詩意的
風景。遠處有一幢古舊的教堂，是很古意的土黃色，圓頂，有頎長的窗，外面的樹光禿禿
的，只剩灰褐的枝桿，若是飄雪，就更詩了。

在這兒，誰都不想，她只想邀你同賞。

可能嗎？

她想，你執意不肯回覆隻字片語，已經說明了一切。她不該一意耽溺在過去的歲月，她必
須讓這些記憶逐漸化為遺忘，如清晨一點點消失的星光。

儘管戀情已然過去，不管怎麼說，對她而言，有你就夠她一生回味了。過去你所給予她的
快樂、美麗、詩情的生活，這輩子是沒有第二個人再能給她的了。

也許有天她會結婚，或許不會，但這已無關緊要了。

無論如何，她對你仍心存感謝。


--",銀杏中有她對你的思念,思念
